{
  "event_id": "00000000-0000-0000-0000-000000000010",
  "event_type": "pos.operation.accepted",
  "empresa_id": "1",
  "version": 1,
  "origin": "terminal-1",
  "correlation_id": "00000000-0000-0000-0000-000000000011",
  "occurred_at": "2026-09-16T12:00:00Z",
  "payload": {"operation_id": "00000000-0000-0000-0000-000000000001", "status": "ACCEPTED"}
}
